{
  "dispatch_id": "DISPATCH-PILOT-0001",
  "task_id": "TASK-PILOT-0001",
  "project_id": "example_project",
  "target_mesh": "mesh-local-pilot",
  "required_capabilities": ["video_pipeline_execution"],
  "dispatch_policy": "capability_match",
  "dispatch_status": "claimed",
  "created_at": "2026-05-30T00:01:00Z",
  "created_by": "coordinator-agent-id",
  "source_refs": [
    "bridge_objects/task_contract.json"
  ]
}
